{
  "manifest_schema_version": "2025-02",
  "app": {
    "id": "com.tesslate.law-onboarding",
    "slug": "law-onboarding",
    "name": "Law Onboarding & Redline",
    "version": "0.1.0",
    "description": "Demo legal client-intake + document-redline workbench. Next.js 16 + NextAuth dashboard with a built-in demo-data layer (runs without a database). Log in with attorney / demo1234.",
    "category": "productivity",
    "forkable": "true"
  },
  "compatibility": {
    "studio": {"min": "0.0.0"},
    "manifest_schema": "2025-02",
    "runtime_api": "^1.0",
    "required_features": []
  },
  "compute": {
    "tier": 1,
    "compute_model": "per-installer",
    "containers": [
      {
        "name": "web",
        "primary": true,
        "image": "tesslate-devserver:latest",
        "ports": [3000],
        "startup_command": "sh -c 'cd /app && (test -d node_modules || bun install) && bun run dev -- --hostname 0.0.0.0 --port 3000'",
        "env": {
          "NEXTAUTH_SECRET": "demo-secret-key-32chars-minimum-ok",
          "NEXTAUTH_URL": "http://localhost:3000",
          "DASHBOARD_USER": "attorney",
          "DASHBOARD_PASSWORD": "demo1234"
        }
      }
    ],
    "connections": []
  },
  "surfaces": [
    {"kind": "ui", "entrypoint": "/"}
  ],
  "state": {"model": "per-install-volume", "volume_size": "2Gi"},
  "billing": {
    "ai_compute": {"payer": "installer", "markup_pct": 0},
    "general_compute": {"payer": "platform"},
    "platform_fee": {"model": "free"}
  },
  "listing": {"visibility": "public"}
}
