{
  "manifest_schema_version": "2025-02",
  "app": {
    "id": "com.tesslate.hello-node",
    "slug": "hello-node",
    "name": "Hello Node",
    "version": "0.1.2",
    "description": "Zero-dependency Node.js server seed — proves the Apps runtime boots a live process (not a static page) with no npm install.",
    "category": "utility",
    "forkable": "true"
  },
  "compatibility": {
    "studio": {"min": "0.0.0"},
    "manifest_schema": "2025-02",
    "runtime_api": "^1.0",
    "required_features": []
  },
  "compute": {
    "tier": 1,
    "compute_model": "per-installer",
    "containers": [
      {
        "name": "web",
        "primary": true,
        "image": "tesslate-devserver:latest",
        "ports": [3000],
        "startup_command": "node /app/server.js",
        "env": {
          "PORT": "3000",
          "NODE_ENV": "production"
        }
      }
    ],
    "connections": []
  },
  "surfaces": [
    {"kind": "ui", "entrypoint": "/"}
  ],
  "state": {"model": "per-install-volume", "volume_size": "256Mi"},
  "billing": {
    "ai_compute": {"payer": "platform"},
    "general_compute": {"payer": "platform"},
    "platform_fee": {"model": "free"}
  },
  "listing": {"visibility": "public"}
}
